{
  "$schema": "http://json-schema.org/draft-07/schema#",
  "description": "Official Replicate API schema for black-forest-labs/flux-2-flex",
  "properties": {
    "seed": {
      "type": "integer",
      "title": "Seed",
      "x-order": 7,
      "description": "Random seed. Set for reproducible generation"
    },
    "steps": {
      "type": "integer",
      "title": "Steps",
      "default": 30,
      "maximum": 50,
      "minimum": 1,
      "x-order": 9,
      "description": "Number of inference steps"
    },
    "width": {
      "type": "integer",
      "title": "Width",
      "maximum": 2048,
      "minimum": 256,
      "x-order": 4,
      "nullable": true,
      "description": "Width of the generated image. Only used when aspect_ratio=custom. Must be a multiple of 16 (if it's not, it will be rounded to nearest multiple of 16)."
    },
    "height": {
      "type": "integer",
      "title": "Height",
      "maximum": 2048,
      "minimum": 256,
      "x-order": 5,
      "nullable": true,
      "description": "Height of the generated image. Only used when aspect_ratio=custom. Must be a multiple of 16 (if it's not, it will be rounded to nearest multiple of 16)."
    },
    "prompt": {
      "type": "string",
      "title": "Prompt",
      "x-order": 0,
      "description": "Text prompt for image generation"
    },
    "guidance": {
      "type": "number",
      "title": "Guidance",
      "default": 4.5,
      "maximum": 10,
      "minimum": 1.5,
      "x-order": 10,
      "description": "Guidance scale for generation. Controls how closely the output follows the prompt"
    },
    "resolution": {
      "allOf": [
        {
          "$ref": "#/components/schemas/resolution"
        }
      ],
      "default": "1 MP",
      "x-order": 3,
      "description": "Resolution in megapixels. Up to 4 MP is possible, but 2 MP or below is recommended. The maximum image size is 2048x2048, which means that high-resolution images may not respect the resolution if aspect ratio is not 1:1.\n\nResolution is not used when aspect_ratio is 'custom'. When aspect_ratio is 'match_input_image', use 'match_input_image' to match the input image's resolution (clamped to 0.5-4 MP)."
    },
    "aspect_ratio": {
      "allOf": [
        {
          "$ref": "#/components/schemas/aspect_ratio"
        }
      ],
      "default": "1:1",
      "x-order": 2,
      "description": "Aspect ratio for the generated image. Use 'match_input_image' to match the first input image's aspect ratio."
    },
    "input_images": {
      "type": "array",
      "items": {
        "type": "string",
        "format": "uri"
      },
      "title": "Input Images",
      "default": [],
      "x-order": 1,
      "description": "List of input images for image-to-image generation. Maximum 10 images. Must be jpeg, png, gif, or webp."
    },
    "output_format": {
      "allOf": [
        {
          "$ref": "#/components/schemas/output_format"
        }
      ],
      "default": "webp",
      "x-order": 11,
      "description": "Format of the output images."
    },
    "output_quality": {
      "type": "integer",
      "title": "Output Quality",
      "default": 80,
      "maximum": 100,
      "minimum": 0,
      "x-order": 12,
      "description": "Quality when saving the output images, from 0 to 100. 100 is best quality, 0 is lowest quality. Not relevant for .png outputs"
    },
    "safety_tolerance": {
      "type": "integer",
      "title": "Safety Tolerance",
      "default": 2,
      "maximum": 5,
      "minimum": 1,
      "x-order": 6,
      "description": "Safety tolerance, 1 is most strict and 5 is most permissive"
    },
    "prompt_upsampling": {
      "type": "boolean",
      "title": "Prompt Upsampling",
      "default": true,
      "x-order": 8,
      "description": "Automatically modify the prompt for more creative generation"
    }
  },
  "required": ["prompt"],
  "title": "flux-2-flex Input Schema",
  "type": "object"
}
